{
  "schema_version": 1,
  "candidate_id": "candidate-001",
  "source_sha": "aaaaaaaaaaaaaaaaaaaaaaaaaaaaaaaaaaaaaaaaaaaaaaaaaaaaaaaaaaaaaaaa",
  "artifact_sha256": "bbbbbbbbbbbbbbbbbbbbbbbbbbbbbbbbbbbbbbbbbbbbbbbbbbbbbbbbbbbbbbbb",
  "config_sha256": "cccccccccccccccccccccccccccccccccccccccccccccccccccccccccccccccc",
  "schema_sha256": "aaaaaaaaaaaaaaaaaaaaaaaaaaaaaaaaaaaaaaaaaaaaaaaaaaaaaaaaaaaaaaaa",
  "test_catalog_sha256": "bbbbbbbbbbbbbbbbbbbbbbbbbbbbbbbbbbbbbbbbbbbbbbbbbbbbbbbbbbbbbbbb",
  "dependency_lock_sha256": "cccccccccccccccccccccccccccccccccccccccccccccccccccccccccccccccc",
  "created_at": "2026-10-09T12:00:00+09:00",
  "status": "DRAFT"
}
